rowid,name,value,name_english,value_english
146,tabellens_indhold,"Tabellen indeholder oplysninger om alle operationer, der er foretaget efter 1. januar 1996. Tabellen indeholder både oplysninger om operationskoderne og deres type samt tid og sted for hver operation og eventuelle tillægskoder til operationerne.Der var ved årsskiftet 1995/1996 et skift i operationsklassifikationen, og det blev håndteret således, at operationer foretaget før årsskiftet blev registreret efter den ’gamle’ klassifikation, mens operationer foretaget efter årsskiftet blev registreret efter den nye nordiske klassifikation, som stadig er gældende. Alle operationer foretaget før 1996 kan findes i tabellen T_OPR.Da de to klassifikationer adskilles på operationsdato betyder det, at patientkontakter der strækker sig henover årsskiftet 1995/1996 godt kan have tilknyttet operationer efter begge operationsklassifikationer. Man skal i disse tilfælde både bruge tabellen T_OPR og T_SKSOPR for at være sikker på at få alle operationer med for de pågældende patientkontakter.",table_content,"The table contains information on all operations carried out after 1 January 1996. The table contains both information on the operation codes and their type as well as the time and place for each operation and any additional codes for the operations. At the turn of the year 1995/1996 a change in the operation classification, and it was handled so that operations performed before the turn of the year were registered according to the 'old' classification, while operations performed after the turn of the year were registered according to the new Nordic classification, which is still valid. in the table T_OPR.Because the two classifications are separated on the date of surgery, this means that patient contacts that extend beyond the turn of the year 1995/1996 may well have been associated with surgeries according to both surgical classifications.In these cases, both T_OPR and T_SKSOPR must be used to ensure include all surgeries for the patient cows in question ntakter. "
147,tabellens_indhold,"Tabellen indeholder oplysninger om alle undersøgelser, ikke-kirurgisk behandlinger, samt administrative koder, der er registreret på hver kontakt. Tabellen omfatter således alle klassifikationskoder, som ikke er en diagnose eller operation, hvilket betyder alle SKS-koder, der begynder med andre bogstaver end D (diagnoser) og K (operationer).Tabellen indeholder både oplysninger om selve procedurekoderne samt tid og sted for hver procedure og eventuelle tillægskoder til proceduren.",table_contents,"The table contains information on all examinations, non-surgical treatments, as well as administrative codes registered on each contact. The table thus includes all classification codes that are not a diagnosis or operation, which means all SKS codes that begins with letters other than D (diagnoses) and K (operations). The table contains both information about the procedure codes themselves as well as the time and place for each procedure and any additional codes for the procedure. "
148,tabellens_indhold,"Tabellen indeholder oplysninger om alle undersøgelser, ikke-kirurgiske behandlinger samt administrative forhold, der er registreret på hver patientkontakt. Tabellen omfatter således alle klassifikationskoder, som ikke er en diagnose eller operation, hvilket betyder alle SKS-koder, der begynder med andre bogstaver end D (diagnoser) og K (operationer).Tabellen indeholder både oplysninger om selve procedurekoderne samt tid og sted for hver procedure og eventuelle tillægskoder til proceduren.",table_contents,"The table contains information on all examinations, non-surgical treatments as well as administrative conditions recorded at each patient contact. The table thus includes all classification codes that are not a diagnosis or operation, which means all SKS codes that begin with letters other than D (diagnoses) and K (operations). The table contains both information about the procedure codes themselves as well as the time and place for each procedure and any additional codes for the procedure. "
149,tabellens_indhold,"Tabellen indeholder oplysninger om datoer for ambulante besøg ved psykiatriske afdelinger. Indtil år 2000 indeholdt tabellen også oplysninger om ydelser, personale og sted i forbindelse med besøget. Disse oplysninger er efterfølgende blevet registreret som administrative procedurekoder og kan findes i tabellen T_SKSUBE.Fra 2003 indeholder tabellen også besøgsdatoer for hjemmebesøg og kan indeholde flere besøgsdatoer pr. dag pr. patient. Hjemmebesøg kan identificeres ved at kigge i tabellen T_SKSUBE efter procedurer med koden AAF6.",table_content,"The table contains information on dates of outpatient visits to psychiatric wards. Until the year 2000, the table also contained information on services, staff and place in connection with the visit. This information has subsequently been registered as administrative procedure codes and can be found in the table T_SKSUBE .From 2003, the table also contains visit dates for home visits and can contain several visit dates per day per patient. Home visits can be identified by looking in the table T_SKSUBE for procedures with the code AAF6. "
150,tabellens_indhold,"Tabellen indeholder oplysninger om den udvidede fritvalgsordning, dvs. om patienten er en fritvalgspatient. Denne tabel er således kun relevant for kontakter på private sygehuse",table_content,"The table contains information about the extended free choice scheme, ie whether the patient is a free choice patient. This table is thus only relevant for contacts in private hospitals "
151,tabellens_indhold,"Tabellen indeholder oplysninger om den udvidede fritvalgsordning, dvs. om patienten er en fritvalgspatient. Denne tabel er således kun relevant for kontakter på private sygehuse.",table_content,"The table contains information about the extended free choice scheme, ie whether the patient is a free choice patient. This table is thus only relevant for contacts at private hospitals. "
152,tabellens_indhold,"Tabellen indeholder oplysninger om dødsfald for danskere med adresse i en dansk kommune, som er døde i Danmark i perioden 1970 - 2001.Dødsårsagerne er de centrale oplysninger i tabellen, men der er også oplysninger som cpr-nummer, dødsdato, køn, alder på dødsdato, om obduktion er foretaget m.v.Data om dødsfald i perioden 2002 - 2014 er indeholdt i tabellen T_dodsaarsag_2. Den vigtigste strukturelle forskel mellem de to tabeller afspejler, at den tilgrundliggende dødsårsag bestemmes på forskellige måder. For perioden 1970 – 2001 blev den udelukkende bestemt via manuel kodning (efterbehandling). For perioden 2002 og frem er den tilgrundliggende dødsårsag bestemt via det automatiske kodningsprogram ACME. Den tilgrundliggende dødsårsag er indeholdt i variablen c_dod1. Se også beskrivelsen af denne.",table_content,"The table contains information on deaths for Danes with an address in a Danish municipality who died in Denmark in the period 1970 - 2001. The causes of death are the key information in the table, but there is also information such as civil registration number, date of death, gender, age at date of death, whether autopsy was performed, etc. Data on deaths in the period 2002 - 2014 are contained in the table T_dodsaarsag_2. The most important structural difference between the two tables reflects that the underlying cause of death is determined in different ways. it is determined exclusively by manual coding (post-processing). For the period 2002 onwards, the underlying cause of death is determined via the automatic coding program ACME. The underlying cause of death is contained in the variable c_dod1. See also the description of this. "
153,tabellens_indhold,"Tabellen indeholder oplysninger om dødsfald for danskere med adresse i en dansk kommune, som er døde i Danmark i perioden 2002 og frem.Dødsårsagerne er de centrale oplysninger i tabellen, men der er også oplysninger som cpr-nummer, dødsdato, køn, alder på dødsdato, om obduktion er foretaget m.v.Data om dødsfald i perioden 1970 – 2001 er indeholdt i tabellen T_dodsaarsag_1. Den vigtigste strukturelle forskel mellem de to tabeller afspejler, at den tilgrundliggende dødsårsag bestemmes på forskellige måder. For perioden 1970 – 2001 blev den udelukkende bestemt via manuel kodning (efterbehandling). For perioden 2002 og frem er den tilgrundliggende dødsårsag bestemt via det automatiske kodningsprogram ACME. Den tilgrundliggende dødsårsag er indeholdt i variablen c_dodtilgrundl_acme. Se også beskrivelsen af denne.",table_content,"The table contains information on deaths for Danes with an address in a Danish municipality who died in Denmark in the period 2002 and onwards. The causes of death are the key information in the table, but there is also information such as civil registration number, date of death, gender, age at date of death, whether autopsy was performed, etc.Data on deaths in the period 1970 - 2001 are contained in the table T_dodsaarsag_1. The most important structural difference between the two tables reflects that the underlying cause of death is determined in different ways. it is determined exclusively via manual coding (post-processing). For the period 2002 onwards, the underlying cause of death is determined via the automatic coding program ACME. The underlying cause of death is contained in the variable c_dodtilgrundl_acme. See also the description of this. "
154,tabellens_indhold,"Tabellen indeholder oplysninger om geografisk stedfæstelse af ulykkeshændelser, der fører til sygehuskontakt. Stedfæstelsen er angivet ved UTM-zone samt x- og y-koordinat og en angivelse af præcisionen for stedfæstelsen.Oplysninger om stedfæstelse er ikke obligatorisk ved registrering af ulykker, så tabellens indehold er langt fra dækkende i forhold til antallet af ulykker der er registreret i Landspatientregisteret.",table_content,"The table contains information on the geographical location of accidents leading to hospital contact. The location is indicated by the UTM zone as well as the x and y coordinates and an indication of the precision of the location. Location information is not mandatory when registering accidents, so that the table of contents is far from comprehensive in relation to the number of accidents registered in the National Patient Register. "
155,tabellens_indhold,"Tabellen indeholder oplysninger om henholdsvis passive venteperioder og om hvorvidt patienten har afslået et tilbud om behandling på en anden sygehusafdeling.Passiv ventetid er ventetid som ikke kan tilskrives afdelingen, men som kan tilskrives patienten eller andre afdelinger.",table_contents,"The table contains information about passive waiting periods and whether the patient has declined an offer of treatment at another hospital ward. Passive waiting time is waiting time that cannot be attributed to the ward, but which can be attributed to the patient or other wards. "
156,tabellens_indhold,"Tabellen indeholder oplysninger om indlæggelsesvilkår/startvilkår for psykiatriske patienter. Herudover indeholder tabellen også oplysninger om, hvor patienten blev indlagt fra og udskrevet til, hvilket var obligatorisk at indberette frem til år 2000.",table_content,"The table contains information on admission conditions / starting conditions for psychiatric patients. In addition, the table also contains information on where the patient was admitted from and discharged to, which was mandatory to report until the year 2000. "
157,tabellens_indhold,"Tabellen indeholder oplysninger om lokale optageområder, f.eks. socialdistrikter i store bykommuner.",table_content,"The table contains information on local catchment areas, eg social districts in large urban municipalities. "
158,tabellens_indhold,"Tabellen indeholder oplysninger om operationer foretaget før 1996. Der var ved årsskiftet 1995/1996 et skift i operationsklassifikationen, og det blev håndteret således, at operationer foretaget før årsskiftet blev registreret efter den ’gamle’ klassifikation, mens operationer foretaget efter årsskiftet blev registreret efter den nye nordiske klassifikation, som stadig er gældende. Alle operationer foretaget siden 1996 kan findes i tabellen T_SKSOPR.Da de to klassifikationer adskilles på operationsdato betyder det, at patientkontakter der strækker sig henover årsskiftet 1995/1996 godt kan have tilknyttet operationer efter begge operationsklassifikationer. Man skal i disse tilfælde både bruge tabellen T_OPR og T_SKSOPR for at være sikker på at få alle operationer med for de pågældende patientkontakter.",table_contents,"The table contains information on operations performed before 1996. At the turn of the year 1995/1996 there was a change in the operation classification, and it was handled so that operations performed before the turn of the year were registered after the 'old' classification, while operations performed after The turn of the year was registered according to the new Nordic classification, which is still valid. All operations performed since 1996 can be found in the table T_SKSOPR. As the two classifications are separated on the date of operation, this means that patient contacts extending beyond the turn of the year 1995/1996 may well be associated with operations. In both cases, both the T_OPR and T_SKSOPR tables must be used to ensure that all surgeries are included for the patient contacts in question. "
159,tabellens_indhold,"Tabellen indeholder oplysninger om samtlige diagnoser der knytter sig til hver kontakt, både selve diagnosekoderne og diagnosernes art samt eventuelle tillægskoder til hver diagnose.",table_content,"The table contains information on all diagnoses associated with each contact, both the diagnostic codes themselves and the nature of the diagnoses as well as any additional codes for each diagnosis. "
160,tabellens_indhold,"Tabellen indeholder oplysninger om samtlige diagnoser der knytter sig til hver kontakt, både selve diagnosekoderne og diagnosernes type samt eventuelle tillægskoder til hver diagnose.",table_content,"The table contains information on all diagnoses associated with each contact, both the diagnosis codes themselves and the type of diagnoses as well as any additional codes for each diagnosis. "
161,tabellens_indhold,"Tabellen indeholder oplysninger om ulykker i form af ulykkeskoder. Oplysningerne fandtes delvist førhen i T_ADM-tabellens variable c_ested, c_emek, c_eakt, c_emodpart, c_etraf og c_epart, der hver indeholdt et særligt kodesæt, men fra år 2000 blev T_ULYK lavet som en særskilt tabel til alle informationerne om ulykker og skader.",table_content,The table contains information about accidents in the form of accident codes. as a separate table for all accident and injury information. 
162,tabellens_indhold,"Tabellen indeholder oplysninger om venteperioder for alle kontakter der har været i et eller flere venteforløb. Dels oplysninger om venteforløbets start- og slutdato og dels en status-kode (ventestatus) for hvert venteforløb.Ventestatus angiver om patienten i den angivne periode er ventende eller ikke ventende, samt på overordnet niveau, hvad patienten venter på og årsagen.",table_contents,"The table contains information about waiting periods for all contacts who have been in one or more waiting processes. Partly information about the start and end date of the waiting process and partly a status code (waiting status) for each waiting process. Waiting status indicates whether the patient in the specified period is pending or not waiting, as well as at the overall level what the patient is waiting for and the reason. "
163,tabellens_indhold,"Tabellen indeholder oplysninger om venteperioder for alle kontakter der har været i et eller flere venteforløb. Dels oplysninger om venteforløbets start- og slutdato og dels en status-kode (ventestatus) for hvert venteforløb.Ventestatus angiver, om patienten i den angivne periode er ventende eller ikke ventende, samt på overordnet niveau, hvad patienten venter på og årsagen hertil.",table_contents,"The table contains information about waiting periods for all contacts who have been in one or more waiting processes. Partly information about the start and end date of the waiting process and partly a status code (waiting status) for each waiting process. Waiting status indicates whether the patient in the specified period is pending or not pending, as well as at the overall level what the patient is waiting for and the reason for this. "
164,tabellens_indhold,"Tabellen indeholder oplysninger om, hvilken afdeling kontakten er udskrevet til for de kontakter, der er afsluttet til anden sygehusafdeling. Det drejer sig primært om kontakter med afslutningsmåde F, G, K eller L (variablen c_udm i t_adm tabellen).",table_content,"The table contains information about which department the contact was printed for for the contacts completed to another hospital ward. These are primarily contacts with termination method F, G, K or L (the variable c_udm in the t_adm table). "
165,tabellens_indhold,"Tabellen indeholder oplysninger om, hvilken sygehusafdeling patienten er udskrevet til for de patienter, der er afsluttet til anden sygehusafdeling. Det drejer sig primært om kontakter med afslutningsmåde F, G, K eller L, hvilket fremgår af variablen c_udm i tabellen T_ADM.",table_content,"The table contains information about which hospital ward the patient has been discharged to for the patients who have been admitted to another hospital ward. These are primarily contacts with termination method F, G, K or L, which appears from the variable c_udm in the table T_ADM. "
166,tabellens_indhold,"Tabellen indeholder specifikation af diagnose i SNOMED-klass., som T-,M-,P-,S-,Æ-akse.",table_content,"The table contains specification of diagnosis in SNOMED class., As T-, M-, P-, S-, Æ-axis. "
167,tabellens_indhold,"Tabellen indeholder visse oplysninger vedrørende fødsler. Det drejer sig både om oplysninger der knytter sig til moderens og til barnets kontakt. For moderen er der tale om oplysninger om graviditetens historik, mens der for barnet er tale om længde, vægt og nummer ved flerfoldsfødsler.Øvrige fødselsoplysninger findes i form af SKS-koder i tabellerne T_DIAG, T_SKSOPR og T_SKSUBE.",table_contents,"The table contains certain information regarding births. This concerns both information related to the mother's and the child's contact. For the mother, this is information about the history of the pregnancy, while for the child it is about length, weight and number for multiple births. Other birth information can be found in the form of SKS codes in the tables T_DIAG, T_SKSOPR and T_SKSUBE. "
168,tabellens_indhold,"Tabellen rummer oplysninger om personernes bopælsforhold over tid på kommune- og regionsplan.Der er kun oplysninger om bopæl i danske kommuner/regioner (ekskl. Grønland). Dvs. at der fx ikke er oplysninger bopæl udlandet.T_bopael kobles med t_diabetes via variablen v_cpr.Tabellen er bygget op om variablen c_kom. C_kom indeholder udelukkende kommnekoder som har været gældende fra og med 2007. Disse benyttes altså også for perioden 1990 – 2006, selvom disse kommunegrænser ikke var gældende endnu.Beregninger for denne periode vil derfor i umiddelbart være rent geografisk og kan ikke direkte knyttes til en konkret kommunal forvaltning.Som ved alle opgørelser baseret på data i registeret denne tabel skal man tage højde for, at en fuld population først skønnes dannet ved udgangen af 1996. Nyinkluderede personer kan dermed først regnes for incidente fra og med 1997.Se også bemærkninger i den genereller beskrivelse af registeret.",table_content,"The table contains information about the persons' place of residence over time at municipal and regional level. There is only information about residence in Danish municipalities / regions (excl. Greenland). Ie that there is no information on residence abroad.T_bopael is linked with t_diabetes via the variable v_cpr.The table is built around the variable c_kom. C_kom only contains municipality codes which have been valid from and including 2007. These are also used for the period 1990 - 2006, although these municipal boundaries were not valid yet. Calculations for this period will therefore be immediately geographically and can not be directly linked to a specific municipal administration.As with all inventories based on data in the register this table, one must take into account that a full population is only estimated to be formed at the end of 1996. Newly included persons can thus only are considered incidents from and including 1997.See also comments in the general description of the register. "
169,tabellens_indhold,"Tabellen rummer to typer oplysninger for personer i registeret.1.Oplysninger for hver enkelt persons inklusion i registeret: Dvs. inklusionsdato, inklusionsårsag (hvilket kriterium man opfyldte ved inklusion i registeret). Der ud over er der oplysninger om, hvilke inklusionskriterier man evt. ellers opfylder og datoer for disse.2.Basisoplysninger som cpr-nummer, fødselsdato, køn og evt. dødsdato.T_diabetes kan kobles til t_bopael via variablen v_cpr.Ved alle opgørelser baseret på data i tabellen skal man tage højde for, at en fuld population først skønnes dannet ved udgangen af 1996. Nyinkluderede personer kan dermed først regnes for incidente fra og med 1997.Se også bemærkninger i den genereller beskrivelse af registeret.",table_contents,"The table contains two types of information for persons in the register.1.Information for each person's inclusion in the register: Ie inclusion date, reason for inclusion (which criterion was met by inclusion in the register). In addition, there is information about, which inclusion criteria you may otherwise meet and dates for these.2.Basic information such as civil registration number, date of birth, sex and possibly date of death.T_diabetes can be linked to t_bopael via the variable v_cpr.In all statements based on data in the table, , that a full population is not estimated to be formed until the end of 1996. Newly included persons can thus only be considered incidents from and including 1997. See also remarks in the general description of the register. "
170,tabellens_indhold,NA,Table_Content,NA 
171,variablebeskrivelse,"Antal kontaktdage, som DRG-kontakten strækker sig over. Beregnet som UDTIDSPUNKT_DRGKONTAKT - INDTIDSPUNKT_DRGKONTAKT + 1 ",variable description,Number of contact days that the DRG contact extends over. Calculated as OUT TIME_DRG CONTACT - IN TIME POINT_DRG CONTACT + 1 
172,variablebeskrivelse,"Antal kontaktdage, som DRG-sygehusforløbet strækker sig over. Beregnet som UDTIDSPUNKT_DRGSGHF - INDTIDSPUNKT_DRGSGHF + 1 ",variable description,Number of contact days that the DRG hospital course extends over. Calculated as OUTPUT POINT_DRGSGHF - INPUT POINT_DRGSGHF + 1 
173,variablebeskrivelse,Antal langliggerdage for DRG-kontakten. Beregnet som LIGGEDAGE_DRGKONTAKT - TRIMPUNKT_DRGKONTAKT ,variable description,Number of long-stay days for the DRG switch. Calculated as LOCATION DAYS_DRG CONTACT - TRIM POINT_DRG CONTACT 
174,variablebeskrivelse,Antal langliggerdage for DRG-sygehusforløbet. Beregnet som LIGGEDAGE_DRGSGHF - TRIMPUNKT_DRGSGHF ,variable description,Number of long-stay days for the DRG hospital course. Calculated as DAY_DRGSGHF - TRIMPUNKT_DRGSGHF 
175,variablebeskrivelse,"Antal liggedage, som DRG-kontakten strækker sig over. Beregnet som UDTIDSPUNKT_DRGKONTAKT - INDTIDSPUNKT_DRGKONTAKT, dog mindst 1 ",variable description,"Number of lying days over which the DRG switch extends. Calculated as EXPENDITURE_DRGCONTACT - INDIDE POINT_DRGCONTACT, however at least 1 "
176,variablebeskrivelse,"Antal liggedage, som DRG-sygehusforløbet strækker sig over. Beregnet som UDTIDSPUNKT_DRGSGHF - INDTIDSPUNKT_DRGSGHF, dog mindst 1. ",variable description,"Number of hospital days that the DRG hospital course extends over. Calculated as UDTIDSPUNKT_DRGSGHF - INDTIDSPUNKT_DRGSGHF, however at least 1. "
177,variablebeskrivelse,Bopælsregion for forløbet. Udvalgt fra udkontakt i forløbet.90: Grønland97: Færøerne98: Udlandet99: Bopæl Ukendt  ,variable description,Residence region for the course. Selected from contact in the course.90: Greenland97: Faroe Islands98: Abroad99: Residence Unknown 
178,variablebeskrivelse,"Kontakttype, der anvendes i grupperingsnøglen. Defineres en ud fra kontakttypen for forløbets kontakter; 9 = forløbet indeholder min. 1 kontakt med kontakttype 9, 6 = forløbet indeholder kun kontakter med kontakttype 5 (ikke-besøg) eller 6 (egne forløb), 5 = forløbet indeholder kun kontakter med kontakttype 5 (ikke-besøg). ",variable description,"Contact type used in the grouping key. Defined one based on the contact type for the course contacts; 9 = the course contains at least 1 contact with contact type 9, 6 = the course only contains contacts with contact type 5 (non-visit) or 6 ( own courses), 5 = the course only contains contacts with contact type 5 (non-visits). "
179,variablebeskrivelse,"Patientens bopælskommune i henhold til CPR-registret på tidspunktet for kontaktens afslutning (UDTIDSPUNKT_DRGKONTAKT). Variablen er forskellig fra den kommunevariabel, som stammer fra LPR, og som angiver kommunekoden umiddelbart før indlæggelsesdagen.I de tilfælde, hvor bopælskommunen i CPR er blank, benyttes dog kommunekoden fra LPR. ",variable description,"The patient's municipality of residence according to the CPR register at the time of the end of the contact (UDTIDSPUNKT_DRGKONTAKT). The variable is different from the municipality variable, which originates from LPR, and which indicates the municipality code immediately before the day of admission. is blank, however, the municipal code from LPR is used. "
