rowid,name,value,name_english,value_english
521,variablebeskrivelse,Langliggerpris for DRG-kontakten beregnet ud fra langliggerdage i LANGLIGGERDAGE,variable description,Long-distance price for the DRG contact calculated on the basis of long-distance days in LONG-LAYING DAYS 
522,variablebeskrivelse,Langliggerpris for DRG-sygehusforløbet beregnet ud fra langliggerdage i LANGLIGGERDAGE_DRGSGHF,variable description,Langliggerpris for the DRG hospital course calculated on the basis of langliggerdage in LANGLIGGERDAGE_DRGSGHF 
523,variablebeskrivelse,"Lønsumsafgift for DRG- eller DAGS-gruppen. Pålægges ikke akutte patienter eller patienter, der har en DRG-takst på 0 kr. Angives i 1.000 kr.",variable description,"Payroll tax for the DRG or DAGS group. Not imposed on acute patients or patients who have a DRG rate of DKK 0. Indicated in DKK 1,000 "
524,variablebeskrivelse,Lønsumsafgift for genoptræning. Pålægges ikke akutte patienter. Pålægges kun for sygehusudskrivninger. Angives i 1.000 kr.,variable description,Payroll tax for rehabilitation. Not imposed on acute patients. Imposed only for hospital discharges. Stated in DKK 10
525,variablebeskrivelse,Lønsumsafgift for langliggerdage. Pålægges ikke akutte patienter. Pålægges kun for sygehusudskrivninger. Angivet i 1.000 kr.,variable description,Payroll tax for long-stay days. Not imposed on acute patients. Imposed only for hospital discharges. Stated in DKK 10
526,variablebeskrivelse,Lønsumsafgiften der er knyttet til gruppen i DRG_DRGSGHF,variable description,The payroll tax attached to the group in DRG_DRGSGHF 
527,variablebeskrivelse,Makroskopibeskrivelse i fri tekst,variable description,Macroscopy description in free text 
528,variablebeskrivelse,"Markering for om patienten er hjernedød. Hvis patienten har bidiagnosen DR991, indsættes en ekstra kontakt til grupperingen, hvormed der også afregnes særskilt for hjernedøde. Se i øvrigt udskrivningstypen",variable description,"Marking for whether the patient is brain dead. If the patient has the co-diagnosis DR991, an extra contact is inserted for the grouping, which is also settled separately for brain death. See also the type of discharge "
529,variablebeskrivelse,Markør for afregning for DRG-sygehusforløbet. Udvalgt fra den dyreste enkeltgrupperede kontakt i forløbet.,variable description,Marker for settlement for the DRG hospital course. Selected from the most expensive single-group contact in the course. 
530,variablebeskrivelse,Markør for afregning.,variable description,Marker for settlement. 
531,variablebeskrivelse,Markør for årsagen til at indlæggelsen eller det ambulante besøg ikke indgår i den statslige aktivitetspulje.,variable description,Marker for the reason why the hospitalization or outpatient visit is not included in the state activity pool. 
532,variablebeskrivelse,Markør for den kommunale medfinansiering.,variable description,Marker for the municipal co-financing. 
533,variablebeskrivelse,Markør for den mellemregionale afregning.,variable description,Marker for the interregional settlement. 
534,variablebeskrivelse,Markør for den statslige aktivitetspulje.,variable description,Marker for the state activity pool. 
535,variablebeskrivelse,Markør for diabetes.,variable description,Marker for diabetes. 
536,variablebeskrivelse,"Markør for indlæggelse, der er sket forud for en genindlæggelse. Patienter der er blevet genindlagt markeres med V_MRK_GENIND. Genindlæggelser opgøres som en akut indlæggelse inden for 30 dage efter en sygehusudskrivning (markeret med V_MRK_GENIND_P). Cancer og ulykker er undtaget. Der tages ikke højde for om aktionsdiagnosen ved første indlæggelse og genindlæggelsen er den samme.",variable description,Marker for hospitalization that has occurred prior to a readmission. Patients who have been readmitted are marked with V_MRK_GENIND. Readmissions are calculated as an acute hospitalization within 30 days after a hospital discharge (marked with V_MRK_GENIND_P). . It is not taken into account whether the action diagnosis at first admission and readmission is the same. 
537,variablebeskrivelse,"Markør for kommunal fuld-finansiering (færdigbehandlede patienter, hospice-patienter og ambulant genoptræning).",variable description,"Marker for full municipal funding (completed patients, hospice patients and outpatient rehabilitation). "
538,variablebeskrivelse,Markør for mellemregional afregning.,variable description,Marker for interregional settlement. 
539,variablebeskrivelse,Markør for meraktivitet.,variable description,Marker for additional activity. 
540,variablebeskrivelse,Markør for om dubletter i procedurekoden har betydning for grupperingsnøglen.,variable description,Marker for whether duplicates in the procedure code have significance for the grouping key. 
541,variablebeskrivelse,Markør for opfyldelse af reglen om at gruppere til 70UA02,variable description,Marker for fulfilling the rule to group to 70UA02 
542,variablebeskrivelse,Markør for opfyldelse af reglen om at gruppere til 70UA03,variable description,Marker for meeting the rule to group to 70UA03 
543,variablebeskrivelse,Markør for opfyldelse af reglen om at gruppere til 90UA01 - Flere besøg ,variable description,Marker for fulfilling the rule of grouping to 90UA01 - More visits 
544,variablebeskrivelse,Markør for opfyldelse af reglen om at gruppere til 90UA03 - Pakkeforløb ,variable description,Marker for fulfilling the rule of grouping to 90UA03 - Package sequence 
545,variablebeskrivelse,Markør for opfyldelse af reglen om at gruppere til 90UA04 - Ikke takstbærende speciale ,variable description,Marker for compliance with the rule of grouping to 90UA04 - Non-taxable thesis 
546,variablebeskrivelse,Markør for patienter der er registreret i Diabetesregistret før datoen for sygehusudskrivningen. Diabetesregistret er opdateret til og med 2008.,variable description,Marker for patients registered in the Diabetes Register before the date of hospital discharge. The diabetes register has been updated up to and including 2008. 
547,variablebeskrivelse,Markør for patienter med affektive sindslidelser. Følgende aktions- eller bidiagnose er anvendt: DF30-39 Markøren findes for takstsystem 2009-2012 (fra år 2008) for versioner af LPR fra 10. juni 2011 til 10. oktober 2013.,variable description,Marker for patients with affective disorders. The following action or co-diagnosis has been used: DF30-39 The marker is available for tariff system 2009-2012 (from the year 2008) for versions of LPR from 10 June 2011 to 10 October 2013. 
548,variablebeskrivelse,Markør for patienter med alkoholforgiftning. Følgende aktions- eller bidiagnose er anvendt: DT51 Markøren findes for takstsystem 2009-2012 (fra år 2008) for versioner af LPR fra 10. juni 2011 til 10. oktober 2013.,variable description,Marker for patients with alcohol poisoning. The following action or co-diagnosis has been used: DT51 The marker is available for tariff system 2009-2012 (from the year 2008) for versions of LPR from 10 June 2011 to 10 October 2013. 
549,variablebeskrivelse,Markør for patienter med AMI. Følgende aktions- eller bidiagnose er anvendt: DI21-23 Markøren findes for takstsystem 2009-2012 (fra år 2008) for versioner af LPR fra 10. juni 2011 til 10. oktober 2013.,variable description,Marker for patients with AMI. The following action or co-diagnosis has been used: DI21-23 The marker is available for tariff system 2009-2012 (from the year 2008) for versions of LPR from 10 June 2011 to 10 October 2013. 
550,variablebeskrivelse,Markør for patienter med anden og dårligt specificeret kræft. Følgende aktions- eller bidiagnose er anvendt: DC76-80 Markøren findes for takstsystem 2009-2012 (fra år 2008) for versioner af LPR fra 10. juni 2011 til 10. oktober 2013.,variable description,Marker for patients with other and poorly specified cancers. The following action or co-diagnosis has been used: DC76-80 The cursor is available for tariff system 2009-2012 (from the year 2008) for versions of LPR from 10 June 2011 to 10 October 2013. 
551,variablebeskrivelse,Markør for patienter med angina pectoris. Følgende aktions- eller bidiagnose er anvendt: DI20 Markøren findes for takstsystem 2009-2012 (fra år 2008) for versioner af LPR fra 10.juni 2011 til 10. oktober 2013.,variable description,Marker for patients with angina pectoris. The following action or co-diagnosis has been used: DI20 The marker is available for tariff system 2009-2012 (from the year 2008) for versions of LPR from 10 June 2011 to 10 October 2013. 
552,variablebeskrivelse,"Markør for patienter med apopleksi (blødning og blodprop). Følgende aktions- eller bidiagnose er anvendt: DI60-69, DG45, DG46 Markøren findes for takstsystem 2009-2012 (fra år 2008) for versioner af LPR fra 10. juni 2011 til 10. oktober 2013.",variable description,"Marker for patients with stroke (bleeding and blood clot). The following action or co-diagnosis has been used: DI60-69, DG45, DG46 The marker is available for rate system 2009-2012 (from year 2008) for versions of LPR from 10. June 2011 to October 10, 2013. "
553,variablebeskrivelse,Markør for patienter med arterieflagren og -flimren. Følgende aktions- eller bidiagnose er anvendt: DI48 Markøren findes for takstsystem 2009-2012 (fra år 2008) for versioner af LPR fra 10. juni 2011 til 10. oktober 2013.,variable description,Marker for patients with arterial flutter and fibrillation. The following action or co-diagnosis has been used: DI48 The cursor is available for tariff system 2009-2012 (from the year 2008) for versions of LPR from 10 June 2011 to 10 October 2013. 
554,variablebeskrivelse,Markør for patienter med astma. Følgende aktions- eller bidiagnose er anvendt: DJ45-46 Markøren findes for takstsystem 2009-2012 (fra år 2008) for versioner af LPR fra 10. juni 2011 til 10. oktober 2013.,variable description,Marker for patients with asthma. The following action or bid diagnosis has been used: DJ45-46 The cursor is available for tariff system 2009-2012 (from the year 2008) for versions of LPR from 10 June 2011 to 10 October 2013. 
555,variablebeskrivelse,"Markør for patienter med behov for rådgivning eller genoptræning ved/efter et alkoholmisbrug. Følgende aktions- eller bidiagnose er anvendt: DZ502, DZ714, DZ721 Markøren findes for takstsystem 2009-2012 (fra år 2008) for versioner af LPR fra 10. juni 2011 til 10. oktober 2013.",variable description,"Marker for patients in need of counseling or rehabilitation in / after an alcohol abuse. The following action or co-diagnosis has been used: DZ502, DZ714, DZ721 The marker is available for tariff system 2009-2012 (from year 2008) for versions of LPR from June 10, 2011 to October 10, 2013. "
556,variablebeskrivelse,Markør for patienter med brystkræft. Følgende aktions- eller bidiagnose er anvendt: DC50. Markøren findes for takstsystem 2009-2012 (fra år 2008) for versioner af LPR fra 10. juni 2011 til 10. oktober 2013.,variable description,Marker for patients with breast cancer. The following action or co-diagnosis has been used: DC50. The marker is available for tariff system 2009-2012 (from the year 2008) for versions of LPR from 10 June 2011 to 10 October 2013. 
557,variablebeskrivelse,"Markør for patienter med demens. Følgende aktions- eller bidiagnose er anvendt: DF00-03, DF051, DG30 Markøren findes for takstsystem 2009-2012 (fra år 2008) for versioner af LPR fra 10. juni 2011 til 10. oktober 2013.",variable description,"Marker for patients with dementia. The following action or co-diagnosis has been used: DF00-03, DF051, DG30 The marker is available for tariff system 2009-2012 (from year 2008) for versions of LPR from 10 June 2011 to 10. October 2013. "
558,variablebeskrivelse,"Markør for patienter med fysiske følger eller tilstande forårsaget af alkoholforbrug. Følgende aktions- eller bidiagnose er anvendt: DK70, DE244, DG312, DG621, DG721, DI426, DK292, DK860, DO354, DP043, DQ860.Markøren findes for takstsystem 2009-2012 (fra år 2008) for versioner af LPR fra 10. juni 2011 til 10. oktober 2013.",variable description,"Marker for patients with physical consequences or conditions caused by alcohol consumption. The following action or co-diagnosis has been used: DK70, DE244, DG312, DG621, DG721, DI426, DK292, DK860, DO354, DP043, DQ860. tariff system 2009-2012 (from year 2008) for versions of LPR from 10 June 2011 to 10 October 2013. "
559,variablebeskrivelse,"Markør for patienter med hjerteinsufficiens. Følgende aktions- eller bidiagnose er anvendt: DI50, DI110, DI130, DI132 Markøren findes for takstsystem 2009-2012 (fra år 2008) for versioner af LPR fra 10. juni 2011 til 10. oktober 2013.",variable description,"Marker for patients with heart failure. The following action or co-diagnosis has been used: DI50, DI110, DI130, DI132 The marker is available for tariff system 2009-2012 (from year 2008) for versions of LPR from 10 June 2011 to 10. October 2013. "
560,variablebeskrivelse,"Markør for patienter med hjertekarsygdomme. Følgende aktions- eller bidiagnose er anvendt: DI24, DI25 Markøren findes for takstsystem 2009-2012 (fra år 2008) for versioner af LPR fra 10. juni 2011 til 10. oktober 2013.",variable description,"Marker for patients with cardiovascular disease. The following action or co-diagnosis has been used: DI24, DI25 The marker is available for tariff system 2009-2012 (from year 2008) for versions of LPR from 10 June 2011 to 10 October 2013. "
561,variablebeskrivelse,"Markør for patienter med hjerteklapsygdom. Følgende aktions- eller bidiagnose er anvendt; DI08, DI09, DI38, DI39, DZ95 Markøren findes for takstsystem 2009-2012 (fra år 2008) for versioner af LPR fra 10. juni 2011 til 10. oktober 2013.",variable description,"Marker for patients with heart valve disease. The following action or co-diagnosis has been used; DI08, DI09, DI38, DI39, DZ95 The marker is available for tariff system 2009-2012 (from year 2008) for versions of LPR from 10 June 2011 to October 10, 2013. "
562,variablebeskrivelse,Markør for patienter med hudkræft. Følgende aktions- eller bidiagnose er anvendt: DC43-44. Markøren findes for takstsystem 2009-2012 (fra år 2008) for versioner af LPR fra 10. juni 2011 til 10. oktober 2013.,variable description,Marker for patients with skin cancer. The following action or co-diagnosis has been used: DC43-44. The marker is available for tariff system 2009-2012 (from the year 2008) for versions of LPR from 10 June 2011 to 10 October 2013. 
563,variablebeskrivelse,"Markør for patienter med hypertension. Følgende aktions- eller bidiagnose er anvendt; DD10-15 Patienter med følgende aktions- eller bidiagnose er udeladt; DI110, DI110, DI130, DZ95 Markøren findes for takstsystem 2009-2012 (fra år 2008) for versioner af LPR fra 10. juni 2011 til 10. oktober 2013.",variable description,"Marker for patients with hypertension. The following action or co-diagnosis has been used; DD10-15 Patients with the following action or co-diagnosis have been omitted; DI110, DI110, DI130, DZ95 The marker is available for rate system 2009-2012 (from year 2008 ) for versions of LPR from 10 June 2011 to 10 October 2013. "
564,variablebeskrivelse,Markør for patienter med knogleskørhed. Følgende aktions- eller bidiagnose er anvendt: DM80-82 Markøren findes for takstsystem 2009-2012 (fra år 2008) for versioner af LPR fra 10. juni 2011 til 10. oktober 2013.,variable description,Marker for patients with osteoporosis. The following action or co-diagnosis has been used: DM80-82 The marker is available for tariff system 2009-2012 (from year 2008) for versions of LPR from 10 June 2011 to 10 October 2013. 
565,variablebeskrivelse,Markør for patienter med KOL. Følgende aktions- eller bidiagnose er anvendt: DJ41-44 Markøren findes for takstsystem 2009-2012 (fra år 2008) for versioner af LPR fra 10. juni 2011 til 10. oktober 2013.,variable description,Marker for patients with COPD. The following action or bid diagnosis has been used: DJ41-44 The cursor is available for tariff system 2009-2012 (from the year 2008) for versions of LPR from 10 June 2011 to 10 October 2013. 
566,variablebeskrivelse,"Markør for patienter med kræft i de endokrine kirtler. Følgende aktions- eller bidiagnose er anvendt: DC73-74, DC750, DC754-759. Markøren findes for takstsystem 2009-2012 (fra år 2008) for versioner af LPR fra 10. juni 2011 til 10. oktober 2013.",variable description,"Marker for patients with cancer of the endocrine glands. The following action or co-diagnosis has been used: DC73-74, DC750, DC754-759. The marker is available for tariff system 2009-2012 (from year 2008) for versions of LPR from June 10, 2011 to October 10, 2013. "
567,variablebeskrivelse,Markør for patienter med kræft i det bloddannende væv. Følgende aktions- eller bidiagnose er anvendt: DC91-96. Markøren findes for takstsystem 2009-2012 (fra år 2008) for versioner af LPR fra 10. juni 2011 til 10. oktober 2013.,variable description,Marker for patients with cancer of the blood-forming tissue. The following action or co-diagnosis has been used: DC91-96. The marker is available for tariff system 2009-2012 (from the year 2008) for versions of LPR from 10 June 2011 to 10 October 2013. 
568,variablebeskrivelse,Markør for patienter med kræft i det lymfatiske væv. Følgende aktions- eller bidiagnose er anvendt: DC81-90. Markøren findes for takstsystem 2009-2012 (fra år 2008) for versioner af LPR fra 10. juni 2011 til 10. oktober 2013.,variable description,Marker for patients with cancer of the lymphatic tissue. The following action or co-diagnosis has been used: DC81-90. The marker is available for tariff system 2009-2012 (from the year 2008) for versions of LPR from 10 June 2011 to 10 October 2013. 
569,variablebeskrivelse,Markør for patienter med kræft i fordøjelsesorganer. Følgende aktions- eller bidiagnose er anvendt: DC15-26. Markøren findes for takstsystem 2009-2012 (fra år 2008) for versioner af LPR fra 10. juni 2011 til 10. oktober 2013.,variable description,Marker for patients with gastrointestinal cancer. The following action or co-diagnosis has been used: DC15-26. The marker is available for tariff system 2009-2012 (from the year 2008) for versions of LPR from 10 June 2011 to 10 October 2013. 
570,variablebeskrivelse,"Markør for patienter med kræft i hjerne, centralnervesystem eller øje. Følgende aktions- eller bidiagnose er anvendt: DC69-72, D751-753, DD32-33, DD352-354, DD42-43, DD443-445. Markøren findes for takstsystem 2009-2012 (fra år 2008) for versioner af LPR fra 10. juni 2011 til 10. oktober 2013.",variable description,"Marker for patients with cancer of the brain, central nervous system or eye. The following action or co-diagnosis has been used: DC69-72, D751-753, DD32-33, DD352-354, DD42-43, DD443-445. The marker available for tariff system 2009-2012 (from the year 2008) for versions of LPR from 10 June 2011 to 10 October 2013. "
571,variablebeskrivelse,Markør for patienter med kræft i knogler og ledbrusk. Følgende aktions- eller bidiagnose er anvendt: DC40-41. Markøren findes for takstsystem 2009-2012 (fra år 2008) for versioner af LPR fra 10. juni 2011 til 10. oktober 2013.,variable description,Marker for patients with bone and cartilage cancer. The following action or co-diagnosis has been used: DC40-41. The marker is available for tariff system 2009-2012 (from the year 2008) for versions of LPR from 10 June 2011 to 10 October 2013. 
572,variablebeskrivelse,Markør for patienter med kræft i kvindelige kønsorganer. Følgende aktions- eller bidiagnose er anvendt: DC51-58. Markøren findes for takstsystem 2009-2012 (fra år 2008) for versioner af LPR fra 10. juni 2011 til 10. oktober 2013.,variable description,Marker for patients with genital cancer. The following action or co-diagnosis has been used: DC51-58. The marker is available for tariff system 2009-2012 (from the year 2008) for versions of LPR from 10 June 2011 to 10 October 2013. 
573,variablebeskrivelse,"Markør for patienter med kræft i luftveje og respirationsorganer. Følgende aktions- eller bidiagnose er anvendt: DC30-39, DC450. Markøren findes for takstsystem 2009-2012 (fra år 2008) for versioner af LPR fra 10. juni 2011 til 10. oktober 2013.",variable description,"Marker for patients with cancer of the respiratory tract and respiratory organs. The following action or co-diagnosis has been used: DC30-39, DC450. The marker is available for tariff system 2009-2012 (from year 2008) for versions of LPR from 10 June 2011 to October 10, 2013. "
574,variablebeskrivelse,Markør for patienter med kræft i mandlige kønsorganer. Følgende aktions- eller bidiagnose er anvendt: DC60-63. Markøren findes for takstsystem 2009-2012 (fra år 2008) for versioner af LPR fra 10. juni 2011 til 10. oktober 2013.,variable description,Marker for patients with male genital cancer. The following action or co-diagnosis has been used: DC60-63. The marker is available for tariff system 2009-2012 (from the year 2008) for versions of LPR from 10 June 2011 to 10 October 2013. 
575,variablebeskrivelse,"Markør for patienter med kræft i mesotel og bindevæv. Følgende aktions- eller bidiagnose er anvendt: DC451-459, DC46-49, DB210. Markøren findes for takstsystem 2009-2012 (fra år 2008) for versioner af LPR fra 10. juni 2011 til 10. oktober 2013.",variable description,"Marker for patients with mesothelioma and connective tissue cancer. The following action or co-diagnosis has been used: DC451-459, DC46-49, DB210. The marker is available for tariff system 2009-2012 (from year 2008) for versions of LPR from June 10, 2011 to October 10, 2013. "
576,variablebeskrivelse,Markør for patienter med kræft i mundhule og svælg. Følgende aktions- eller bidiagnose er anvendt: DC00-14. Markøren findes for takstsystem 2009-2012 (fra år 2008) for versioner af LPR fra 10. juni 2011 til 10. oktober 2013.,variable description,Marker for patients with cancer of the oral cavity and pharynx. The following action or co-diagnosis has been used: DC00-14. The marker is available for tariff system 2009-2012 (from the year 2008) for versions of LPR from 10 June 2011 to 10 October 2013. 
577,variablebeskrivelse,"Markør for patienter med kræft i urinveje. Følgende aktions- eller bidiagnose er anvendt: DC64-68, DD090-091, DD301-309, DD411-419. Markøren findes for takstsystem 2009-2012 (fra år 2008) for versioner af LPR fra 10. juni 2011 til 10. oktober 2013.",variable description,"Marker for patients with urinary tract cancer. The following action or co-diagnosis has been used: DC64-68, DD090-091, DD301-309, DD411-419. The marker is available for rate system 2009-2012 (from year 2008) for versions of LPR from June 10, 2011 to October 10, 2013. "
578,variablebeskrivelse,Markør for patienter med psykiske og adfærdsmæssige forstyrrelser forårsaget af et alkoholmisbrug. Følgende aktions- eller bidiagnose er anvendt: DF10 Markøren findes for takstsystem 2009-2012 (fra år 2008) for versioner af LPR fra 10. juni 2011 til 10. oktober 2013.,variable description,Marker for patients with mental and behavioral disorders caused by an alcohol abuse. The following action or co-diagnosis has been used: DF10 The marker is available for tariff system 2009-2012 (from year 2008) for versions of LPR from 10 June 2011 to 10 October 2013. 
579,variablebeskrivelse,"Markør for patienter med reumatroid arthrit (gigtlidelser). Følgende aktions- eller bidiagnose er anvendt: DM05, DM06 Markøren findes for takstsystem 2009-2012 (fra år 2008) for versioner af LPR fra 10. juni 2011 til 10. oktober 2013.",variable description,"Marker for patients with rheumatoid arthritis (rheumatic disorders). The following action or co-diagnosis has been used: DM05, DM06 The marker is available for rate system 2009-2012 (from year 2008) for versions of LPR from 10 June 2011 to 10. October 2013. "
580,variablebeskrivelse,Markør for patienter med skizofreni. Følgende aktions- eller bidiagnose er anvendt: DF20 Markøren findes for takstsystem 2009-2012 (fra år 2008) for versioner af LPR fra 10. juni 2011 til 10. oktober 2013.,variable description,Marker for patients with schizophrenia. The following action or co-diagnosis has been used: DF20 The marker is available for tariff system 2009-2012 (from 2008) for versions of LPR from 10 June 2011 to 10 October 2013. 
